{
  "proof_id": "S0-09",
  "classification": "conformance_checked_decision",
  "recorded_at": "2026-09-26T10:26:37.563120Z",
  "env_fingerprint": "sandbox:vm",
  "runs": [
    {
      "leg": "positive",
      "cmd": [
        "python3",
        "proofs/S0-09/check_conformance.py",
        "docs/adr/0005-foundry-host.md"
      ],
      "started_at": "2026-09-26T10:26:37.519034Z",
      "finished_at": "2026-09-26T10:26:37.538676Z",
      "exit_code": 0,
      "stdout_sha256": "4ffd7da7307802f31441c4f15fe445290765cc67e3f036c107b5c98f7e8207e3",
      "stderr_sha256": "e3b0c44298fc1c149afbf4c8996fb92427ae41e4649b934ca495991b7852b855"
    },
    {
      "leg": "negative",
      "cmd": [
        "python3",
        "proofs/S0-09/check_conformance.py",
        "proofs/S0-09/fixtures/neg-missing-section.md"
      ],
      "started_at": "2026-09-26T10:26:37.538808Z",
      "finished_at": "2026-09-26T10:26:37.557245Z",
      "exit_code": 1,
      "stdout_sha256": "43b055be9e864094e2cf2c5ac64ba07b2eb3bdc6e9af949f5826bda4d6652448",
      "stderr_sha256": "e3b0c44298fc1c149afbf4c8996fb92427ae41e4649b934ca495991b7852b855",
      "failure_reason": "adr-incomplete: missing required section: Consequences"
    }
  ],
  "negative_control": {
    "fixture": "python3 proofs/S0-09/check_conformance.py proofs/S0-09/fixtures/neg-missing-section.md",
    "expected_failure_reason": "adr-incomplete: missing required section",
    "observed_failure_reason": "adr-incomplete: missing required section: Consequences"
  },
  "attestation": {
    "scripts/proof-runner": "40fbbf9fc85a5457c067d06bebfc4aa012136b3ee5747d961eea75d1c531c0ce",
    "scripts/validate-ledger": "f1eb20ff26c879395c63a9c6e322927a5380970a92957c8c2d04d73db6e8e7a9",
    "proofs/registry.yaml": "e392a7f46661963c8c40fb37c661f61aff4e03013824b52fabf9ed2979802201",
    "proofs/schemas/blocked.schema.json": "bbe4a1a68dc3f1c3dfc38855846d7c2540adda8e332721991622824f88e705b6",
    "proofs/schemas/probe.schema.json": "bd71b22e47bea10f92f17fbc79d62ed729e514a4734223f9da2d6e7a0492e80e",
    "proofs/schemas/result.schema.json": "8bd5dabd0a4d87b7f9e0b985066a4c6db3d2191a9406e8bbfa9475babc2566c5",
    "proofs/schemas/spec.schema.json": "f425996d48f22316e96b9ca638de1aee617d7ca063388741534d5cffe95f5715",
    "proofs/schemas/spike.schema.json": "d2c3ad52b76b48e727cb748cfde9f9ad1e92ad801a6bbef3266b6f4342a6c773",
    "proofs/S0-09/check_conformance.py": "05a60682c1c26e7dd5b28719b1ed8a3feac2e7712f31cd6d17228b4c062f6548",
    "proofs/S0-09/fixtures/neg-missing-section.md": "9f2904e0a82c6297a008f646b5c58385462873173aa674e20458be0a1e8e2cfe",
    "proofs/S0-09/spec.json": "45b9f6e0951e173f1ed8dd87d5a5bc0c3561768468ad7291c960be11da7d552a",
    "docs/adr/0005-foundry-host.md": "b633640396f3e892f1c8736a96c72c28a0e8015bbb27e863cdbc0205e2809fdf"
  },
  "digest": "a2c667c9c25dcf49f0f5ded63eb1e4cdeac924c2185de1a819b174e99aca5ece"
}
